{"$schema":"https://json-schema.org/draft/2020-12/schema","$id":"https://yaaw.dev/schemas/change-set.schema.json","type":"object","required":["schema","id","state","changes"],"properties":{"schema":{"const":"yaaw.change-set/v1"},"id":{"type":"string","minLength":1},"state":{"enum":["DRAFT","READY","INTEGRATING","DONE","CANCELLED"]},"changes":{"type":"array","minItems":1,"items":{"type":"object","required":["id","repository","work_id","base_ref","head_ref"],"properties":{"id":{"type":"string","minLength":1},"repository":{"type":"string","minLength":1},"work_id":{"type":"string","minLength":1},"base_ref":{"type":"string","minLength":1},"head_ref":{"type":"string","minLength":1},"depends_on":{"type":"array","items":{"type":"string"},"uniqueItems":true},"required_checks":{"type":"array","items":{"type":"string"},"uniqueItems":true},"release_environment":{"type":["string","null"]}},"additionalProperties":false}},"release_order":{"type":"array","items":{"type":"string"},"uniqueItems":true}},"additionalProperties":false}
