{"schema":"yaaw.change-set/v1","id":"CS-AUTH-ROLLING","state":"READY","changes":[{"id":"api","repository":"example/api","work_id":"DEL-API-1","base_ref":"main","head_ref":"feat/auth-api","required_checks":["test"]},{"id":"web","repository":"example/web","work_id":"DEL-WEB-1","base_ref":"main","head_ref":"feat/auth-web","depends_on":["api"],"required_checks":["test"],"release_environment":"STAGING"}],"release_order":["api","web"]}
